,Unnamed: 0,title,isNPI
0,0,inflammatory and microbiological associations with near-fatal asthma requiring extracorporeal membrane oxygenation,0
1,1,-nc-nd license (http://creativecommons.org/licenses/by-nc-nd/4.0/),0
2,2,"transmission potential of the novel coronavirus (covid-19) onboard the diamond princess cruises ship, 2020",1
3,3,identification of a novel coronavirus causing severe pneumonia in human: a descriptive study,0
4,4,"a conceptual model for the coronavirus disease 2019 (covid-19) outbreak in wuhan, china with individual reaction and governmental action",1
5,5,integrated cross-species analysis identifies a conserved transitional dendritic cell population hhs public access,0
6,6,supplemental information structure and function analysis of an antibody recognizing all influenza a subtypes,0
7,7,characterization of a novel influenza virus in cattle and swine: proposal for a new genus in the orthomyxoviridae family,0
8,8,a novel pathogenic mammalian orthoreovirus from diarrheic pigs and swine blood meal in the united states,0
9,9,search strategy pubmed databases were searched for studies on mers cases during the 2015 outbreak in the republic of korea. the search terms used were combinations of 'middle east respiratory syndrome' in all fields and 'korea' in all,0
10,10,note rapid detection and differentiation of avian infectious bronchitis virus: an application of mass genotype by melting temperature analysis in rt-qpcr using sybr green i,0
11,11,-nc-nd license (http://creativecommons.org/licenses/by-nc-nd/4.0/),
12,12,comparative evaluation of three homogenization methods for isolating middle east respiratory syndrome coronavirus nucleic acids from sputum samples for real-time reverse transcription pcr,0
13,13,mers-coronavirus: from discovery to intervention-nc-nd license (http://creativecommons.org/licenses/by-nc-nd/4.0/),1
14,14,a new measure for assessing the public health response to a middle east respiratory syndrome coronavirus outbreak corresponding author: sung-il,1
15,15,the characteristics of middle eastern respiratory syndrome coronavirus transmission dynamics in south korea,1
16,16,-nc-nd license (http://creativecommons.org/licenses/by-nc-nd/4.0/),
17,17,the characteristics of middle eastern respiratory syndrome coronavirus transmission dynamics in south korea,1
18,18,evaluation of admissions to the major incident hospital based on a standardized protocol,1
19,19,brief communication correlation between pneumonia severity and pulmonary complications in middle east respiratory syndrome,0
20,20,bacterial artificial chromosomes: a functional genomics tool for the study of positive-strand rna viruses,0
21,21,epidemic and case investigations surveillance operation for the 141st confirmed case of middle east respiratory syndrome coronavirus in response to the patient's prior travel to jeju island,1
22,22,c urrent opinion back to basics: hand hygiene and isolation,1
23,23,adverse effects of isolation in hospitalised patients: a systematic review,1
24,24,modeling the impact of quarantine during an outbreak of ebola virus disease-nc-nd license (http://creativecommons.org/licenses/by-nc-nd/4.0/),1
25,25,"a survey on infection control in emergency departments in japan committee for infection control for the emergency department, the japanese association for acute medicine, and the joint working group",1
26,26,impact of isolation on hospitalised patients who are infectious: systematic review with meta-analysis,1
27,27,taiwan's experience in hospital preparedness and response for emerging infectious diseases,1
28,28,feasibility of controlling covid-19 outbreaks by isolation of cases and contacts,1
29,29,intensive care unit relocation and its effect on multidrug-resistant respiratory microorganisms,1
30,30,establishment of epstein-barr virus growth-transformed lymphoblastoid cell lines,0
31,31,isolation and identification of feline calicivirus and feline herpesvirus in southern brazil,0
32,32,"50696    the first case of  novel coronavirus pneumonia imported into korea from wuhan, china implication for infection prevention and control measures
Name: title, dtype: object",1
33,33,"study on inactivation of porcine epidemic diarrhoea virus, porcine sapelovirus 1 and adenovirus in the production and storage of laboratory spray-dried porcine plasma",0
34,34,a dna biochip for on-the-spot multiplexed pathogen identification,0
35,35,asian spine journal • pissn 1976-1902 eissn 1976-7846 • www.asianspinejournal.org asian spine,0
36,36,media impact switching surface during an infectious disease outbreak,1
37,37,risk management and healthcare policy dovepress critical role of ethics in clinical management and public health response to the west africa ebola epidemic,1
38,38,highly pathogenic avian influenza a virus h5n1 non-structural protein 1 is associated with apoptotic activation of the intrinsic mitochondrial pathway,0
39,39,the utility of preliminary patient evaluation in a febrile respiratory infectious disease unit outside the emergency department,1
40,40,understanding human coronavirus hcov-nl63,0
41,41,case report,
42,42,mers-coronavirus: from discovery to intervention-nc-nd license (http://creativecommons.org/licenses/by-nc-nd/4.0/),1
43,43,a deep nasopharyngeal swab versus nonendoscopic bronchoalveolar lavage for isolation of bacterial pathogens from preweaned calves with respiratory disease,0
44,44,"Series([], Name: title, dtype: object)",
45,45,examining landscape factors influencing relative distribution of mosquito genera and frequency of virus infection,1
46,46,"Series([], Name: title, dtype: object)",
47,47,"middle east respiratory syndrome coronavirus superspreading event involving 81 persons, korea 2015",0
48,48,"8525    combination treatment with quercetin and resveratrol attenuates high fat dietinduced obesity and associated inflammation in rats via the ampkαsirt signaling pathway
Name: title, dtype: object",0
49,49,effect of isolation practice on the transmission of middle east respiratory syndrome coronavirus among hemodialysis patients a 2-year prospective cohort study,1
50,50,the infection of primary avian tracheal epithelial cells with infectious bronchitis virus,0
51,51,an updated estimation of the risk of transmission of the novel coronavirus (2019-ncov)-nc-nd license (http://creativecommons.org/licenses/by-nc-nd/4.0/),1
52,52,necrotizing enteritis caused by pharyngostomum cordatum infection in a stray cat,0
53,53,"Series([], Name: title, dtype: object)",
54,54,"group b betacoronavirus in rhinolophid bats, japan",0
55,55,"personal, occupational, and public health perspectives on dealing with the first case of influenza a (h1n1) in the united arab emirates",1
56,56,-nc-nd license (http://creativecommons.org/licenses/by-nc-nd/4.0/).-nc-nd license (http://creativecommons.org/licenses/by-nc-nd/4.0/). infectious disease modelling 5 (2020) 264e270,0
57,57,structural factors of the middle east respiratory syndrome coronavirus outbreak as a public health crisis in korea and future response strategies,1
58,58,prevention of respiratory outbreaks in the rehabilitation setting,1
59,59,rapid and sensitive insulated isothermal pcr for point-of-need feline leukaemia virus detection,0
60,60,-nc-nd license (http://creativecommons.org/licenses/by-nc-nd/4.0/),
61,61,supporting information,
62,62,highly infectious diseases in the mediterranean sea area: inventory of isolation capabilities and recommendations for appropriate isolation,1
63,63,perspective reverse vaccinology 2.0: human immunology instructs vaccine antigen design,0
64,64,"6756    tuberculosis prevention in healthcare workers in china  years after the severe acute respiratory syndrome pandemic
Name: title, dtype: object",1
65,65,highly infectious diseases in the mediterranean sea area: inventory of isolation capabilities and recommendations for appropriate isolation,1
66,66,feasibility of controlling covid-19 outbreaks by isolation of cases and contacts,1
67,67,-nc-nd license (http://creativecommons.org/licenses/by-nc-nd/4.0/).-nc-nd license (http://creativecommons.org/licenses/by-nc-nd/4.0/). infectious disease modelling 5 (2020) 264e270,0
68,68,of the creative commons attribution non-commercial 4.0 license (cc by-nc 4.0). iranian emergency medical service response in disaster; report of three earthquakes,1
69,69,middle east respiratory syndrome coronavirus quasispecies that include homologues of human isolates revealed through whole- genome analysis and virus cultured from dromedary camels in saudi arabia,0
70,70,-nc-nd license (http://creativecommons.org/licenses/by-nc-nd/4.0/),
71,71,"16087    outofhospital cohort treatment of coronavirus disease  patients with mild symptoms in korea an experience from a single community treatment center
Name: title, dtype: object",1
72,72,"12505    first pediatric case of coronavirus disease  in korea
Name: title, dtype: object",0
73,73,structure and function analysis of an antibody recognizing all influenza a subtypes article structure and function analysis of an antibody recognizing all influenza a subtypes,0
74,74,an updated estimation of the risk of transmission of the novel coronavirus (2019-ncov)-nc-nd license (http://creativecommons.org/licenses/by-nc-nd/4.0/),1
75,75,"emerging microbes and infections (2012) 1, e23",0
76,76,clinical and epidemiologic characteristics of spreaders of middle east respiratory syndrome coronavirus during the 2015 outbreak in korea,0
77,77,feasibility of controlling covid-19 outbreaks by isolation of cases and contacts,1
78,78,patient isolation precautions: are they worth it?,1
79,79,"awareness, knowledge, attitude and preventive practice of leptospirosis among healthy malaysian and non-malaysian wet market workers in selected urban areas in selangor, malaysia",1
80,80,"open access fever screening and detection of febrile arrivals at an international airport in korea: association among self-reported fever, infrared thermal camera scanning, and tympanic temperature",1
81,81,"emerging microbes & infections (2017) 6, e1",0
82,82,high correlation of middle east respiratory syndrome spread with google search and twitter trends in korea,0
83,83,bmc infectious diseases quarantine for pandemic influenza control at the borders of small island nations,1
84,84,"construction and characterization of recombinant human adenovirus type 5 expressing foot-and-mouth disease virus capsid proteins of indian vaccine strain, o/ind/r2/75",0
85,85,isolation facilities for highly infectious diseases in europe -a cross-sectional analysis in 16 countries,1
86,86,analysis and numerical simulations of a stochastic seiqr epidemic system with quarantine-adjusted incidence and imperfect vaccination,1
87,87,real-time reverse transcription pcr assay for detection of senecavirus a in swine vesicular diagnostic specimens,0
88,88,efficacy of an adjuvanted middle east respiratory syndrome coronavirus spike protein vaccine in dromedary camels and alpacas,0
89,89,presence of vaccine-derived newcastle disease viruses in wild birds a11111,0
90,90,self-reported anticipated compliance with physician advice to stay home during pandemic (h1n1) 2009: results from the 2009 queensland social survey,1
91,91,susceptibility loci revealed for bovine respiratory disease complex in pre-weaned holstein calves,0
92,92,containing the accidental laboratory escape of potential pandemic influenza viruses,0
93,93,replication and shedding of mers- cov in jamaican fruit bats (artibeus jamaicensis) open,0
94,94,"general hospital staff worries, perceived sufficiency of information and associated psychological distress during the a/h1n1 influenza pandemic",1
95,95,"open peer review therapeutic strategies in an outbreak scenario to treat the novel coronavirus originating in wuhan, china [version 2; peer review: 2 approved] , cepheid, danaher diagnostic",1
96,96,clinical medicine incubation period and other epidemiological characteristics of 2019 novel coronavirus infections with right truncation: a statistical analysis of publicly available case data,0
97,97,e3 ligase itch interacts with the z matrix protein of lassa and mopeia viruses and is required for the release of infectious particles,0
98,98,monitoring the systemic human memory b cell compartment of melanoma patients for anti-tumor igg antibodies,0
99,99,the role of severe acute respiratory syndrome (sars)-coronavirus accessory proteins in virus pathogenesis,0
100,100,isolation and characterization of adenoviruses infecting endangered golden snub-nosed monkeys (rhinopithecus roxellana),0
101,101,self-collected mid-turbinate swabs for the detection of respiratory viruses in adults with acute respiratory illnesses,0
102,102,the effectiveness of contact tracing in emerging epidemics,1
103,103,first isolation of west nile virus from a dromedary camel,0
104,104,the first evidence of a new genotype of nephropathogenic infectious bronchitis virus circulating in vaccinated and unvaccinated broiler flocks in algeria,0
105,105,correspondence: jantien a backer (jantien.backer@rivm.nl),0
106,106,"2047    the role of facemasks and hand hygiene in the prevention of influenza transmission in households results from a cluster randomised trial berlin, germany,
Name: title, dtype: object",1
107,107,bmc infectious diseases influenza pandemic intervention planning using influsim: pharmaceutical and non-pharmaceutical interventions,0
108,108,a porcine enterovirus g associated with enteric disease contains a novel papain-like cysteine protease,0
109,109,development of oligonucleotide microarray for accurate and simultaneous detection of avian respiratory viral diseases,0
110,110,"preparedness of hospitals in the republic of ireland for an influenza pandemic, an infection control perspective",0
111,111,"evaluation of preparedness of healthcare student volunteers against middle east respiratory syndrome coronavirus (mers-cov) in makkah, saudi arabia: a cross-sectional study",0
112,112,"8262    review article the human intestinal virome in health and disease
Name: title, dtype: object",0
113,113,a novel strategy for efficient production of anti-v3 human scfvs against hiv-1 clade c,0
114,114,"genomic analyses of human european diversity at the southwestern edge: isolation, african influence and disease associations in the canary islands",0
115,115,insights into the transmission of respiratory infectious diseases through empirical human contact networks open,1
116,116,genetic evidence of middle east respiratory syndrome coronavirus (mers-cov) and widespread seroprevalence among camels in kenya,0
117,117,controlling epidemic spread by social distancing: do it well or not at all,1
118,118,"serological evidence of mers-cov antibodies in dromedary camels (camelus dromedaries) in laikipia county, kenya",0
119,119,"knowledge, attitudes and behaviours of healthcare workers in the kingdom of saudi arabia to mers coronavirus and other emerging infectious diseases",0
120,120,unique epitopes recognized by antibodies induced in chikungunya virus-infected non-human primates: implications for the study of immunopathology and vaccine development,0
121,121,selection and characterization of monoclonal antibodies targeting middle east respiratory syndrome coronavirus through a human synthetic fab phage display library panning,0
122,122,"replication of h9 influenza viruses in the human ex vivo respiratory tract, and the influence of neuraminidase on virus release open",0
123,123,feline calicivirus and other respiratory pathogens in cats with feline calicivirus- related symptoms and in clinically healthy cats in switzerland,0
124,124,"incidence and outcomes of acute respiratory distress syndrome a nationwide registry-based study in taiwan, 1997 to 2011",0
125,125,hypsugopoxvirus: a novel poxvirus isolated from hypsugo savii in italy,0
126,126,genome3d: a viewer-model framework for integrating and visualizing multi-scale epigenomic information within a three-dimensional genome,0
127,127,exhaled air dispersion during coughing with and without wearing a surgical or n95 mask,1
128,128,hazard analysis of critical control points assessment as a tool to respond to emerging infectious disease outbreaks,0
129,129,first isolation and rapid identification of newcastle disease virus from aborted fetus of dromedary camel using next-generation sequencing,1
130,130,intentions to perform non-pharmaceutical protective behaviors during influenza outbreaks in sweden: a cross-sectional study following a mass vaccination campaign,1
131,131,risk factors for febrile respiratory illness and mono-viral infections in a semi-closed military environment: a case-control study,0
132,132,oct-4 expression maintained cancer stem-like properties in lung cancer-derived cd133-positive cells,0
133,133,"6476    assessment of pathogenicity and tissue distribution of infectious bronchitis virus strains italy  genotype isolated from moroccan broiler chickens
Name: title, dtype: object",0
134,134,development of a quantitative loop-mediated isothermal amplification assay for the rapid detection of novel goose parvovirus,0
135,135,multiple sclerosis: the role of cytokines in pathogenesis and in therapies,0
136,136,large eddy simulation of air escape through a hospital isolation room single hinged doorway-validation by using tracer gases and simulated smoke videos,0
137,137,"clinical, pathological, and molecular investigation of mycoplasma pulmonis-induced murine respiratory mycoplasmosis in a rat (rattus norvegicus) colony",0
138,138,spatial/temporal analysis in infectious disease outbreaks stem: an open source tool for disease modeling,1
139,139,"isolation and genetic characterization of human coronavirus nl63 in primary human renal proximal tubular epithelial cells obtained from a commercial supplier, and confirmation of its replication in two different types of human primary kidney cells",0
140,140,incorporating media data into a model of infectious disease transmission,1
141,141,comparison of eplex respiratory pathogen panel with laboratory- developed real-time pcr assays for detection of respiratory pathogens,0
142,142,itraq-based proteomic analysis of porcine kidney epithelial pk15 cells infected with pseudorabies virus open,0
143,143,rapid detection of the common avian leukosis virus subgroups by real-time loop-mediated isothermal amplification,0
144,144,deep sequencing for the detection of virus-like sequences in the brains of patients with multiple sclerosis: detection of gbv-c in human brain,0
145,145,"10739    infectious bronchitis virus from chickens in alhasa, saudi arabia
Name: title, dtype: object",0
146,146,the golgi associated eri3 is a flavivirus host factor open,0
147,147,rapid and simple colorimetric detection of multiple influenza viruses infecting humans using a reverse transcriptional loop- mediated isothermal amplification (rt-lamp) diagnostic platform,0
148,148,metapneumovirus g and f proteins during virus-like particle formation,0
149,149,molecules isolation and characterization of a phaseolus vulgaris trypsin inhibitor with antiproliferative activity on leukemia and lymphoma cells,0
150,150,identification and characterization of a new orthoreovirus from patients with acute respiratory infections,0
151,151,a bayesian inferential approach to quantify the transmission intensity of disease outbreak,0
152,152,"10212    genetic diversity of the yokose virus, xybx, isolated from bats myotis daubentonii in china
Name: title, dtype: object",0
153,153,coinfection of diarrheagenic bacterial and viral pathogens in piglets of northeast region of india,0
154,154,"marilones a-c, phthalides from the sponge-derived fungus stachylidium sp",0
155,155,correspondence: jantien a backer (jantien.backer@rivm.nl),0
156,156,"Series([], Name: title, dtype: object)",0
157,157,clinical management of respiratory syndrome in patients hospitalized for suspected middle east respiratory syndrome coronavirus infection in the paris area from 2013 to 2016,0
158,158,isolation and characterization of a novel gammaherpesvirus from a microbat cell line a new report describes the isolation and characterization of a novel gammaherpesvirus from a microbat cell line crossmark,0
159,159,"data-based analysis, modelling and forecasting of the covid-19 outbreak",1
160,160,lentivirus display: stable expression of human antibodies on the surface of human cells and virus particles,0
161,161,the effects of media reports on disease spread and important public health measurements,1
162,162,exhaled breath condensate sampling is not a new method for detection of respiratory viruses,0
163,163,"novel, divergent simian hemorrhagic fever viruses in a wild ugandan red colobus monkey discovered using direct pyrosequencing",0
164,164,"viral respiratory tract infections in adult patients attending outpatient and emergency departments, a pcr/electrospray ionization mass spectrometry study",0
165,165,reassessing therapeutic antibodies for neglected and tropical diseases,0
166,166,"a new species of mesonivirus from the northern territory, australia",0
167,167,strategies to target specific components of the ubiquitin conjugation/deconjugation machinery,0
168,168,"health system capacity in sydney, australia in the event of a biological attack with smallpox",0
169,169,a web-based resource for designing therapeutics against ebola virus open,0
170,170,myricetin: a dietary molecule with diverse biological activities,0
171,171,occurrence and sequence analysis of porcine deltacoronaviruses in southern china,0
172,172,"science china isolation and characterization of dengue virus serotype 2 from the large dengue outbreak in guangdong, china in 2014 isolation and characterization of dengue virus serotype 2 from the large dengue outbreak in guangdong",0
173,173,the development and application of the two real-time rt-pcr assays to detect the pathogen of hfmd,0
174,174,"pertussis: the identify, isolate, inform tool applied to a re-emerging respiratory illness",0
175,175,investigation of a potential zoonotic transmission of orthoreovirus associated with acute influenza-like illness in an adult patient,0
176,176,epidemiologic features of the first mers outbreak in korea: focus on pyeongtaek st. mary's hospital,0
177,177,"systematic identification of novel, essential host genes affecting bromovirus rna replication",0
178,178,inevitable isolation and the change of stress markers in hemodialysis patients during the 2015 mers- cov outbreak in korea open,0
179,179,identification of a novel bat papillomavirus by metagenomics,0
180,180,"the role of misshapen nck-related kinase (mink), a novel ste20 family kinase, in the ires-mediated protein translation of human enterovirus 71",0
181,181,clinical implications of rapid eplex® respiratory pathogen panel testing compared to laboratory-developed real-time pcr,0
182,182,"widespread recombination, reassortment, and transmission of unbalanced compound viral genotypes in natural arenavirus infections",0
183,183,bmc infectious diseases small islands and pandemic influenza: potential benefits and limitations of travel volume reduction as a border control measure,0
184,184,a section of the journal frontiers in microbiology isolation and identification of porcine epidemic diarrhea virus and its effect on host natural immune response,0
185,185,"strategy and technology to prevent hospital-acquired infections: lessons from sars, ebola, and mers in asia and west africa",1
186,186,genotyping and phylogenetic analysis of canine parvovirus circulating in egypt,0
187,187,viral and bacterial upper respiratory tract infection in hospital health care workers over time and association with symptoms,0
188,188,"molecules anti-inflammatory and anti-allergic activities of pentaherb formula, moutan cortex (danpi) and gallic acid",0
189,189,building ventilation as an effective disease intervention strategy in a dense indoor contact network in an ideal city,1
190,190,an approach to and web-based tool for infectious disease outbreak intervention analysis open,1
191,191,"): e20165. 2008zx10003011), the national nature science foundation of china (no. 30872300), university basic scientific research expense, the youth development project (no. 09ykpy76), the china postdoctoral science foundation (no. 20090460804) and the national key basic",0
192,192,"12269    epidemiology, causes, clinical manifestation and diagnosis, prevention and control of coronavirus disease covid during the early outbreak period a scoping review
Name: title, dtype: object",1
193,193,bmc public health what infection control measures will people carry out to reduce transmission of pandemic influenza? a focus group study,1
194,194,hla-dmb restricts human t-cell leukemia virus type-1 (htlv-1) protein expression via regulation of atg7 acetylation open,0
195,195,"identification of an infectious bronchitis coronavirus strain exhibiting a classical genotype but altered antigenicity, pathogenicity, and innate immunity profile open",0
196,196,isolation and characterization of porcine epidemic diarrhea virus associated with the 2014 disease outbreak in mexico: case report,0
197,197,get the news out loudly and quickly: the influence of the media on limiting emerging infectious disease outbreaks,1
198,198,"40494    novel coronavirus of pneumonia in wuhan, china emerging attack and management strategies
Name: title, dtype: object",1
199,199,different types of door-opening motions as contributing factors to containment failures in hospital isolation rooms,1
200,200,"epidemiological evaluation of cat health at a first-response animal shelter in fukushima, following the great east japan earthquakes of 2011",0
201,201,analysis of vsv pseudotype virus infection mediated by rubella virus envelope proteins open,0
