,Unnamed: 0,title,isNPI
403,403,a human inferred germline antibody binds to an immunodominant epitope and neutralizes zika virus,0
404,404,open access r440 pneumothorax and mortality in the mechanically ventilated sars patients: a prospective clinical study,0
405,405,the effect of contact investigations and public health interventions in the control and prevention of measles transmission: a simulation study,1
406,406,projecting social contact matrices in 152 countries using contact surveys and demographic data author summary,1
407,407,"the novel coronavirus outbreak in wuhan, china",0
408,408,asymptomatic middle east respiratory syndrome coronavirus infection using a serologic survey in korea,0
409,409,altered gut microbiota profiles in sows and neonatal piglets associated with porcine epidemic diarrhea virus infection open,0
410,410,bmc veterinary research loop-mediated isothermal amplification as an emerging technology for detection of yersinia ruckeri the causative agent of enteric red mouth disease in fish,0
411,411,journal pre-proof covid-19 in a patient with long-term use of glucocorticoids: a study of a familial cluster covid-19 in a patient with long-term use of glucocorticoids: a study of a familial cluster,0
412,412,"infection control o14 surgical site infection surveillance in france: the first 1999-2004 trend analysis o21 evaluation of a rapid molecular dipstick assay for the direct detection of methicillin-resistant staphylococcus aureus in clinical specimens o23 impact of hypochlorite disinfection on mrsa rates resistance surveillance o24 multi-drug resistant enterococci among portuguese swine after growth promoter ban o27 european antimicrobial susceptibility surveillance in animals (eassa): results (2002/2003) for enteric bacteria from healthy cattle, pigs and chickens from 8 countries",0
413,413,physica a effects of asymptomatic infection on the dynamical interplay between behavior and disease transmission in multiplex networks,1
414,414,super-spreaders and the rate of transmission of the sars virus,0
415,415,growth characteristics and protein profiles of prototype and wild-type rat coronavirus isolates grown in a cloned subline of mouse fibroblasts (l2p.176 cells),0
416,416,health careeassociated infection outbreaks in pediatric long-term care facilities,0
417,417,-nc-nd license (http://creativecommons.org/licenses/by-nc-nd/4.0/). peer-review under responsibility of the centro congressi internazionale srl sciencedirect directional airflow and ventilation in hospitals: a case study of secondary airborne infection peer-review under responsibility of the centro congressi internazionale srl,1
418,418,optimal control for sirc epidemic outbreak,1
419,419,"gp73, a novel golgi-localized protein upregulated by viral infection",0
420,420,particularités épidémiologiques et prévention des infections nosocomiales virales epidemiologic characteristics and prevention of viral nosocomial infections,1
421,421,"selected topics: disaster medicine implementation of the hospital emergency incident command system during an outbreak of severe acute respiratory syndrome (sars) at a hospital in taiwan, roc",1
422,422,curtailing transmission of severe acute respiratory syndrome within a community and its hospital †,1
423,423,the association of streptococcus equi subsp. zooepidemicus with canine infectious respiratory disease,0
424,424,the global polio laboratory network as a platform for the viral vaccine-preventable and emerging diseases laboratory networks hhs public access,0
425,425,effectiveness of contact precautions against multidrug-resistant organism transmission in acute care: a systematic review of the literature hhs public access,1
426,426,"preparation, quality criteria, and properties of human blood platelet lysate supplements for ex vivo stem cell expansion",0
427,427,effect of antibiotic treatment in preweaned holstein calves after experimental bacterial challenge with pasteurella multocida,0
428,428,"tumor; endothelium; macrophage; ac-ldl; cd16 (okaji, y. (295) 183) bactericidal assay (sba) (liu, x. (292) 187) keyword index vol",0
429,429,a single amino acid mutation in the spike protein of coronavirus infectious bronchitis virus hampers its maturation and incorporation into virions at the nonpermissive temperature,0
430,430,design and application of the method for isolating magnetotactic bacteria,0
431,431,emergency departments (eds) in the united kingdom (uk) are not prepared for emerging biological threats and bioterrorism,0
432,432,applications of infrared thermography for noncontact and noninvasive mass screening of febrile international travelers at airport quarantine stations,1
433,433,incubation periods of acute respiratory viral infections: a systematic review,0
434,434,molecular diagnosis of respiratory enterovirus infections: use of pcr and molecular identification for a best approach of the main circulating strains during 2008,0
435,435,mimicry of human ige epitopes by anti-idiotypic antibodies,0
436,436,magnetic particles for the separation and purification of nucleic acids,0
437,437,"2328    environmental and occupational health response to sars, taiwan,
Name: title, dtype: object",1
438,438,detection of antibody-secreting cells specific for the cytomegalovirus and herpes simplex virus surface antigens,0
439,439,evaluation of multiple commercial molecular and conventional diagnostic assays for the detection of respiratory viruses in children,0
440,440,could influenza transmission be reduced by restricting mass gatherings? towards an evidence-based policy framework,1
441,441,effectiveness of the middle east respiratory syndrome- coronavirus protocol in enhancing the function of an emergency department in qatar hhs public access,1
442,442,clinical and i)iagnostic virology advances in the diagnosis of respiratory virus infections,0
443,443,building the infrastructure and regulations needed for public health and fitness learning objectives,1
444,444,middle east respiratory syndrome coronavirus transmission among health care workers: implication for infection control,1
445,445,notification and disease control: obligations of the medical practitioner under public health legislation 43,1
446,446,systematic review of economic evaluations of preparedness strategies and interventions against influenza pandemics,1
447,447,"archives of virology virus isolation and serum, antibody responses after infection of cats with transmissible gastroenteritis virus brieireport",0
448,448,"trends in the chemical and pharmacological research on the tropical trees calophyllum brasiliense and calophyllum inophyllum, a global context",0
449,449,a methodology for optimal placement of sensors in enclosed environments: a dynamical systems approach,1
450,450,d 2 ea: depict the epidemic picture of covid-19,1
451,451,the emergence of the middle east respiratory syndrome coronavirus excellent review on timely and newly emerging infectious diseases,1
452,452,detection of enterotoxigenic k99 (f5) and f41 from fecal sample of calves by molecular and serological methods,0
453,453,understanding the accessory viral proteins unique to the severe acute respiratory syndrome (sars) coronavirus,0
454,454,isolation of a novel viral agent associated with porcine reproductive and neurological syndrome and reproduction of the disease,0
455,455,evaluation of a latex agglutination kit (virogen rotatest) for detection of bovine rotavirus in fecal samples †,0
456,456,selection of staphylococcal enterotoxin b (seb)-binding peptide using phage display technology,0
457,457,construction of a large naïve human phage-displayed fab library through one-step cloning,0
458,458,a dynamic compartmental model for the middle east respiratory syndrome outbreak in the republic of korea: a retrospective analysis on control interventions and superspreading events-nc-nd license (http://creativecommons.org/licenses/by-nc-nd/4.0/),1
459,459,psychological impact of the 2015 mers outbreak on hospital workers and quarantined hemodialysis patients,0
460,460,sciencedirect article original agents infectieux émergents emerging infectious agents,1
461,461,an rt-pcr assay for detection of infectious bronchitis coronavirus serotypes,0
462,462,"building upon current knowledge and techniques of indoor microbiology to construct the next era of theory into microorganisms, health, and the built environment",1
463,463,mers: emergence of a novel human coronavirus,1
464,464,modeling and public health emergency responses: lessons from sars,1
465,465,is influenza-like illness a useful concept and an appropriate test of influenza vaccine effectiveness?,0
466,466,rotavirus diarrhea in bovines and other domestic animals,0
467,467,"49195    coronavirus disease  covid and pregnancy what obstetricians need to know
Name: title, dtype: object",0
468,468,simulating the sars outbreak in beijing with limited data,0
469,469,cfd simulation of airborne pathogen transport due to human activities,0
470,470,isolation of a novel serotype strain of infectious bronchitis virus zz2004 from ducks in china,0
471,471,prospective comparison of r-mix tm shell vial system with direct antigen tests and conventional cell culture for respiratory virus detection,0
472,472,airborne transmission and precautions: facts and myths,1
473,473,isolation of influenza viruses in mdck 33016pf cells and clearance of contaminating respiratory viruses,0
474,474,nonhuman primate quarantine: its evolution and practice,0
475,475,persistence and evolution of feline coronavirus in a closed cat-breeding colony,0
476,476,dissemination of intestinal pathogens between lambs and puppies in sheep farms,0
477,477,chapter 3 virology,0
478,478,dynamics of a model with quarantine-adjusted incidence and quarantine of susceptible individuals,1
479,479,marine lectins and their medicinal applications,0
480,480,"14485    emerging biomedical applications of synthetic biology
Name: title, dtype: object",0
481,481,"clinical course and risk factors for mortality of adult inpatients with covid-19 in wuhan, china: a retrospective cohort study",0
482,482,contact tracing and disease control,1
483,483,biological and genetic analysis of a bovine-like coronavirus isolated from water buffalo (bubalus bubalis) calves,0
484,484,practice of epidemiology when is quarantine a useful control strategy for emerging infectious diseases?,1
485,485,"common virus infections in cats, before and after being placed in shelters, with emphasis on feline enteric coronavirus",0
486,486,a method for evaluating health care workers' personal protective equipment technique,1
487,487,is systems biology the key to preventing the next pandemic? nih public access author manuscript,1
488,488,characterization and pathogenicity of a novel mammalian orthoreovirus from wild short-nosed fruit bats,0
489,489,detection of bovine coronaviruses from adult cows with epizootic diarrhea and their antigenic and biological diversities brief report,0
490,490,variation in health care worker removal of personal protective equipment,1
491,491,development of real-time fluorescent reverse transcription loop-mediated isothermal amplification assay with quenching primer for influenza virus and respiratory syncytial virus,0
492,492,assessing hospital preparedness using an instrument based on the mass casualty disaster plan checklist: results of a statewide survey,1
493,493,door-opening motion can potentially lead to a transient breakdown in negative-pressure isolation conditions: the importance of vorticity and buoyancy airflows,0
494,494,"delayed suspicion, treatment and isolation of tuberculosis patients in pulmonology/ infectious diseases and non-pulmonology/ infectious diseases wards",0
495,495,antigenic relationship between human coronavirus strain dc 43 and hemagglutinating encephalomyelitis virus strain 67n of swine: antibody responses in human and animal sera,0
496,496,infection preventionists' experience during the first months of the 2009 novel h1n1 influenza a pandemic,1
497,497,sciencedirect coupled disease-behavior dynamics on complex networks: a review,1
498,498,chapter 7 isolation and propagation of coronaviruses in embryonated eggs,0
499,499,the use of endogenous and exogenous reference rnas for qualitative and quantitative detection of prrsv in porcine semen,0
500,500,baculovirus as versatile vectors for protein expression in insect and mammalian cells r e v i e w,0
501,501,survival of hendra virus in the environment: modelling the effect of temperature,1
502,502,detection by reverse transcription-polymerase chain reaction of influenza c in nasopharyngeal secretions of adults with a common cold,0
503,503,coronavirus (jhm) replication within the retina: analysis of cell tropism in mouse retinal cell cultures,0
504,504,where do pets fit into human quarantines?,0
505,505,chlamydia pneumoniae and exacerbations of asthma in adults,0
506,506,bioinformatics insight into the spike glycoprotein gene of field porcine epidemic diarrhea strains during,0
507,507,"use of a multiplex rt-pcr assay for simultaneous detection of the north american genotype porcine reproductive and respiratory syndrome virus, swine influenza virus and japanese encephalitis virus",0
508,508,preliminary assessment of the covid-19 outbreak using 3-staged model e-ishr,0
509,509,severe acute respiratory syndrome-a global concern-influenza virus isolated from suspected cases in brazil from april to june 2003,1
510,510,hidden cluster detection for infectious disease control and quarantine management,1
511,511,emergency department design,1
512,512,one-tube nested rt-pcr enabled by using a plastic film and its application for the rapid detection of sars-virus,1
513,513,"prediction of smallpox outbreak and evaluation of control-measure policy in japan, using a mathematical model",0
514,514,artificial infectious disease optimization: a seiqr epidemic dynamic model-based function optimization algorithm,0
515,515,infection control and prevention practices implemented to reduce transmission risk of middle east respiratory syndrome-coronavirus in a tertiary care institution in saudi arabia,1
516,516,les vaccins de demain,0
517,517,development of a murine model to study the pathogenesis of rotavirus infection,0
518,518,trait-mediated effects of parasites on invader-native interactions,0
519,519,algal lectins as promising biomolecules for biomedical research,0
520,520,"isolation and molecular characterization of nephropathic infectious bronchitis virus isolates of gujarat state, india",0
521,521,continuous monitoring of aerial bioburden within intensive care isolation rooms and identification of high-risk activities,0
522,522,sensitive and rapid detection of zika virus by loop-mediated isothermal amplification,0
523,523,a clustering of rna recombination sites adjacent to a hypervariable region of the peplomer gene of murine coronavirus,0
524,524,clinical considerations in the diagnosis of viral respiratory infections,0
525,525,"detection of group 2a coronaviruses with emphasis on bovine and wild ruminant strains virus isolation and detection of antibody, antigen, and nucleic acid",0
526,526,separation and isolation methods for analysis of the active principles of sho-saiko-to (sst) oriental medicine,0
527,527,a new isolation method for rat intraepithelial lymphocytes,0
528,528,"hospital casa maternitat, barcelona), v. ausina (hospital universitari germans trias i pujol",0
529,529,clinical significance of respiratory virus detection in patients with acute exacerbation of interstitial lung diseases,0
530,530,sciencedirect a duplex rt-pcr assay for detection of h9 subtype avian influenza viruses and infectious bronchitis viruses,0
531,531,two resource distribution strategies for dynamic mitigation of influenza pandemics,1
532,532,journal pre-proof individual risk management strategy and potential therapeutic options for the covid-19 pandemic individual risk management strategy and potential therapeutic options for the covid-19 pandemic,1
533,533,"44109    experimental infection of islike infectious bronchitis virus in specific pathogen free and commercial broiler chicks
Name: title, dtype: object",0
534,534,suicidal behaviour and suicide prevention in later life,0
535,535,modified n95 mask delivers high inspired oxygen concentrations while effectively filtering aerosolized microparticles,0
536,536,the final size of a sars epidemic model without quarantine,0
537,537,infectious exacerbations of chronic obstructive pulmonary disease associated with respiratory viruses and non-typeable haemophilus in£uenzae,0
538,538,entry screening for infectious diseases in humans perspective find emerging infectious disease information on,0
539,539,phage display technique identifies the interaction of severe acute respiratory syndrome coronavirus open reading frame 6 protein with nuclear pore complex interacting protein npipb3 in modulating type i interferon antagonism,0
540,540,what are the most common domains of the core competencies of disaster nursing? a scoping review,0
541,541,laboratory diagnosis of sars laboratory diagnosis of sars emerging infectious diseases • www,0
542,542,"original articles generalized reproduction numbers, sensitivity analysis and critical immunity levels of an seqijr disease model with immunization and varying total population size-nc-nd license (http://creativecommons.org/licenses/by-nc- nd/4.0/)",0
543,543,severe outbreak of bovine coronavirus infection in dairy cattle during the warmer season,0
544,544,journal pre-proof contingency management strategies of the nursing department in centralized rescue of patients with coronavirus disease 2019 author statement. contingency management strategies of the nursing department in centralized rescue of patients with coronavirus disease 2019,0
545,545,the first identification and retrospective study of severe fever with thrombocytopenia syndrome in japan,0
546,546,"2965    virulent avian infectious bronchitis virus, people’s republic of china
Name: title, dtype: object",0
547,547,rapid review the psychological impact of quarantine and how to reduce it: rapid review of the evidence,1
548,548,human metapneumovirus detection in patients with severe acute respiratory syndrome,0
549,549,winter dysentery of adult cattle virus,0
550,550,intestinal replication of a porcine respiratory coronavirus closely related antigenically to the enteric transmissible gastroenteritis virus,0
551,551,computer-aided detection of severe acute respiratory syndrome (sars) on chest radiography,0
552,552,modelling strategies for controlling sars outbreaks,1
553,553,special issue lessons learned from international responses to severe acute respiratory syndrome (sars),1
554,554,modelling the outbreak of infectious disease following mutation from a non-transmissible strain,0
555,555,metagenomic analysis of the jinding duck fecal virome,0
556,556,a loophole in international quarantine procedures disclosed during the sars crisis,1
557,557,single-domain antibodies as promising experimental tools in imaging and isolation of porcine epidemic diarrhea virus,0
558,558,prophylactic antibody treatment and intramuscular immunization reduce infectious human rhinovirus 16 load in the lower respiratory tract of challenged cotton rats,0
559,559,the performance of rt-pcr compared with a rapid serological assay for acute dengue fever in a diagnostic laboratory,0
560,560,chapter 2 nested-rt-pcr and multiplex rt-pcr for diagnosis of rhinovirus infection in clinical samples,0
561,561,"evidence of human coroanvirus (229e), in patients with respiratory infec- tion, iran, 2015: the first report",0
562,562,risk management and health care policy,1
563,563,genetic diversity of avian infectious bronchitis coronavirus strains isolated in china between 1995 and 2004,0
564,564,diagnosis of human respiratory syncytial virus infection using reverse transcription loop-mediated isothermal amplification,0
565,565,collecting data to assess sars interventions,1
566,566,article in press g model the roles of bacteria and viruses in bronchiectasis exacerbation: a prospective study article in press g model,0
567,567,antibody responses to respiratory coronavirus infections of cattle during shipping fever pathogenesis,0
568,568,"30147    cumulative author index for
Name: title, dtype: object",0
569,569,"molecular characterization of rotavirus isolated from alpaca (vicugna pacos) crias with diarrhea in the andean region of cusco, peru",0
570,570,reproduction of postweaning multisystemic wasting syndrome (pmws) in immunostimulated and non-immunostimulated 3-week-old piglets experimentally infected with porcine circovirus type 2 (pcv2),0
571,571,heroes of sars: professional roles and ethics of health care workers,0
572,572,the potential of targeted antibody prophylaxis in sars outbreak control: a mathematic analysis $,0
573,573,network inference from multimodal data: a review of approaches from infectious disease transmission,0
574,574,health policy fangcang shelter hospitals: a novel concept for responding to public health emergencies,1
575,575,cell culture and electron microscopy for identifying viruses in diseases of unknown cause,0
576,576,clinical commentary iii chest uncharted paths· hospital networks in critical care,0
577,577,forecasting versus projection models in epidemiology: the case of the sars epidemics,1
578,578,pandemic simulation of antivirals + school closures: buying time until strain-specific vaccine is available,1
579,579,the impact of community structure of social contact network on epidemic outbreak and effectiveness of non-pharmaceutical interventions,1
580,580,clinical and virological data of the first cases of covid-19 in europe: a case series,0
581,581,"an isothermal, label-free, and rapid one-step rna amplification/detection assay for diagnosis of respiratory viral infections",0
582,582,pneumonia in pediatric outpatients: cause and clinical manifestations,0
583,583,original article,0
584,584,series 416 www,0
585,585,molecular characterization of infectious bronchitis viruses isolated from broiler and layer chicken farms in egypt during 2012 production and hosting by elsevier,0
586,586,viruses demonstrated in children in tanzania: studies in diarrhoea and measles,0
587,587,infection control practices in facilities for highly infectious diseases across europe,1
588,588,investigation on the contaminant distribution with improved ventilation system in hospital isolation rooms: effect of supply and exhaust air diffuser configurations,0
589,589,diagnóstico de las faringitis estreptocócicas,0
590,590,pandemic h1n1 in canada and the use of evidence in developing public health policies e a policy analysis,1
591,591,journal pre-proof transmission potential and severity of covid-19 in south korea title: transmission potential and severity of covid-19 in south korea,0
592,592,using a novel rapid viral test to improve triage of emergency department patients with acute respiratory illness during flu season,1
593,593,insect contribution to horizontal transmission of reticuloendotheliosis virus,0
594,594,susceptibility of rodent cell lines to rat coronaviruses and differential enhancement by trypsin or deae-dextran,0
595,595,genome analysis of a g9p[23] group a rotavirus isolated from a dog with diarrhea in china,0
596,596,formalin respiratory syncytial virus entry and how to block it,0
597,597,airborne pathogen isolation capability in emergency departments of us children's hospitals,0
598,598,the power of detention in the management of non-compliance with tuberculosis treatment: a survey of irish practitioners and analysis of potential legal liability,1
599,599,exhaled air dispersion distances during noninvasive ventilation via different respironics face masks,0
600,600,"experience of severe acute respiratory syndrome in singapore: importation of cases, and defense strategies at the airport",1
601,601,the initial hospital response to an epidemic,1
602,602,effectiveness of contact precautions against multidrug- resistant organism transmission in acute care: a systematic review of the literature,1
603,603,"45072    generation and characterization of eptesicus fuscus big brown bat kidney cell lines immortalized using the myotis polyomavirus large tantigen
Name: title, dtype: object",0
604,604,effect of single-versus double-gloving on virus transfer to health care workers' skin and clothing during removal of personal protective equipment,0
605,605,community acquired respiratory virus infections in cancer patientsdguideline on diagnosis and management by the infectious diseases working party of the german society for haematology and medical oncology,1
606,606,"2327    model parameters and outbreak control for sars
Name: title, dtype: object",1
607,607,one-step real-time rt-pcr for pandemic influenza a virus (h1n1) 2009 matrix gene detection in swine samples,0
608,608,development and application of a reverse transcription loop-mediated isothermal amplification method for rapid detection of duck hepatitis a virus type 1,0
609,609,the human ige repertoire,
610,610,hapiosamates a and b: new steroidal sulfamate esters from two hapiosclerid sponges,
611,611,"identification of wu polyomavirus from pediatric patients with acute respiratory infections in beijing, china",
612,612,healthcare worker exposure to middle east respiratory syndrome coronavirus (mers-cov): revision of screening strategies urgently needed,
613,613,"bioactivities, isolation and purification methods of polysaccharides from natural products: a review",
614,614,"development and evaluation of an antigen-capture elisa for detection of the ul24 antigen of the duck enteritis virus, based on a polyclonal antibody against the ul24 expression protein",
