,Unnamed: 0,title,isNPI
615,615,the diagnosis of viral respiratory disease in older adults,
616,616,"a new seir epidemic model with applications to the theory of eradication and control of diseases, and to the calculation of r 0",
617,617,development of three multiplex rt-pcr assays for the detection of 12 respiratory rna viruses,
618,618,sars epidemical forecast research in mathematical model,
619,619,saturday i may i97i respiratory syncytial and other viruses associated with respiratory disease in infants,
620,620,the effect of incidence functions on the dynamics of a quarantine/isolation model with time delay,
621,621,an improved culture system for virus isolation and detection *,
622,622,factors involved in the aerosol transmission of infection and control of ventilation in healthcare premises,
623,623,differentiated cultures of primary hamster tracheal airway epithelial cells,
624,624,"characterization of escherichia coli isolated from calf diarrhea in and around kombolcha, south wollo, amhara region, ethiopia",
625,625,discovery of a novel swine enteric alphacoronavirus (seacov) in southern china,
626,626,management of inpatients exposed to an outbreak of severe acute respiratory syndrome (sars),
627,627,the difference in the incubation period of 2019 novel coronavirus (sars-cov-2) infection between travelers to hubei and non-travelers: the need of a longer quarantine period,
628,628,natural ventilation for reducing airborne infection in hospitals,
629,629,"aerobic bacteriological studies on the respiratory tracts of apparently healthy and pneumonic camels (camelus dromedaries) in selected districts of afar region, ethiopia",
630,630,"follow-up of contacts of middle east respiratory syndrome coronavirus- infected returning travelers, the netherlands, 2014 technical appendix part 1: laboratory methods for pcr detection of mers-cov and antibody detection",
631,631,porcine reproductive and respiratory syndrome virus and haemophilus parasuis antigen distribution in dually infected pigs,
632,632,infection control for sars in a tertiary paediatric centre in hong kong,
633,633,the impact of non-pharmaceutical interventions for 2009 h1n1 influenza on travel intentions: a model of goal-directed behavior,
634,634,"series terrorism and health 2 confronting the threat of bioterrorism: realities, challenges, and defensive strategies",
635,635,cycloartenol triterpenoid saponins from cimicifuga simplex (ranunculaceae) and their biological effects,
636,636,"23921    airbornedroplet infection isolation
Name: title, dtype: object",
637,637,framework for the design and operation of high-level isolation units: consensus of the european network of infectious diseases,
638,638,effects of environmental disinfection on the isolation of vancomycin-resistant enterococcus after a hospital-associated outbreak of middle east respiratory syndrome,
639,639,a¯u optical immunoassay (thermobiostar's flu oia): a diagnostic tool for improved in¯uenza management,
640,640,transnational quarantine rhetorics: public mobilization in sars and in h1n1 flu huiling ding,
641,641,"immunoprophylaxis against important virus diseases of horses, farm animals and birds",
642,642,"42368    application of the updated cdc isolation guidelines for health care facilities
Name: title, dtype: object",
643,643,the seasonality of rhinovirus infections and its implications for clinical recognition,
644,644,serological assays for emerging coronaviruses: challenges and pitfalls,
645,645,discrimination between transmissible gastroenteritis virus isolates brief report,
646,646,massively parallel pathogen identification using high-density microarrays,
647,647,clinical infectious diseases environmental contamination and viral shedding in mers patients during mers-cov outbreak in south korea,
648,648,"clinical infectious diseases serologic follow-up of middle east respiratory syndrome coronavirus cases and contacts-abu dhabi, united arab emirates",
649,649,an improved reverse genetics system for mammalian orthoreoviruses,
650,650,"2174    pandemic hn  among quarantined close contacts, beijing, people’s republic of china
Name: title, dtype: object",
651,651,investigation of the effects and aftereffects of naturally occurring upper respiratory tract illnesses on mood and performance,
652,652,infectious canine hepatitis: an ''old'' disease reemerging in italy,
653,653,molecular characterization and phylogenetic analyses of virulent infectious bronchitis viruses isolated from chickens in eastern saudi arabia,
654,654,"prediction of smallpox outbreak and evaluation of control-measure policy in japan, using a mathematical model",
655,655,detection of respiratory viruses from arti patients by xtag rvp fast v2 assay and conventional methods,
656,656,memory elements,
657,657,"2255    realtime reverse transcription–polymerase chain reaction assay for sarsassociated coronavirus
Name: title, dtype: object",
658,658,the relevance of psychosocial variables and working conditions in predicting nurses' coping strategies during the sars crisis: an online questionnaire survey,
659,659,in situ reverse-transcription loop-mediated isothermal amplification (in situ rt-lamp) for detection of japanese encephalitis viral rna in host cells,
660,660,"incidence of novel coronavirus (2019-ncov) infection among people under home quarantine in shenzhen, china",
661,661,assessing hospital emergency management plans: a guide for infection preventionists,
662,662,role of neutralizing antibodies in adults with community-acquired pneumonia by respiratory syncytial virus,
663,663,personal view can we contain the covid-19 outbreak with the same measures as for sars?,
664,664,role of rhinovirus in respiratory tract infections in hospitalized children background,
665,665,a nested pcr approach for unambiguous typing of pestiviruses infecting cattle,
666,666,milk immunoglobulins for health promotion,
667,667,precautionary behavior in response to perceived threat of pandemic infl uenza,
668,668,hospital-acquired viral pathogens in the neonatal intensive care unit,
669,669,magazorb: a simple tool for rapid isolation of viral nucleic acids,
670,670,"a comparison of the susceptibility of three human gut tumour-derived differentiated epithelial cell lines, primary monkey kidney cells and human rhabdomyosarcoma cell line to 6qprototype strains of human enteroviruses",
671,671,the impact of city epidemics on rural labor market: the korean middle east respiratory syndrome case,
672,672,"epidemiological and clinical characteristics of heart transplant recipients during the 2019 coronavirus outbreak in wuhan, china: a descriptive survey report",
673,673,highly efficient and practical n-heterocyclic carbene organocatalyzed chemoselective n 1 /c 3 -functionalization of isatins with green chemistry principles,
674,674,"medical students' knowledge, perceptions, and behavioral intentions towards the h1n1 influenza, swine flu, in pakistan: a brief report",
675,675,has the virus of multiple sclerosis been isolated?,
676,676,the prospect of pandemic influenza: why should the optometrist be concerned about a public health problem?,
677,677,general review dna microarrays for the diagnosis of infectious diseases puces à adn pour le diagnostic des infections bactériennes,
678,678,review the interference by maternaij~y-derived antibody with active immunization of farm animals against foot-and-mouth disease,
679,679,severe acute respiratory syndrome and sport facts and fallacies,
680,680,"30074    subject index, volumes
Name: title, dtype: object",
681,681,bacterial and parasitic diseases of columbiformes,
682,682,the influence of age and genetics on natural resistance to experimentally induced feline infectious peritonitis,
683,683,epidemiology and infection seeking out sari: an automated search of electronic health records,
684,684,a compartmental model for the analysis of sars transmission patterns and outbreak control measures in china,
685,685,-nc-nd license (http://creativecommons.org/licenses/by- nc-nd/4.0/),
686,686,"48369    viruses are prevalent in nonventilated hospitalacquired pneumonia
Name: title, dtype: object",
687,687,"articles the effect of control strategies to reduce social mixing on outcomes of the covid-19 epidemic in wuhan, china: a modelling study",
688,688,pathogenic murine coronaviruses iii. biological and biochemical characterization of temperature- sensitive mutants of jhmv,
689,689,timely identification of optimal control strategies for emerging infectious diseases $,
690,690,sustained meticillin-resistant staphylococcus aureus control in a hyper-endemic tertiary acute care hospital with infrastructure challenges in singapore,
691,691,pneumonie virale sévère de l'immunocompétent viral pneumonia in immunocompetent patients,
692,692,impact of quarantine on the 2003 sars outbreak: a retrospective modeling study,
693,693,illness in intensive care staff after brief exposure to severe acute respiratory syndrome,
694,694,seroprevalence of antibody to severe acute respiratory syndrome (sars)- associated coronavirus among health care workers in sars and non-sars medical wards,
695,695,computational studies for the structure and function of mrpe65,
696,696,rapid diagnosis of respiratory virus infections patients with acute respiratory disease in,
697,697,virus detection and its association with symptoms during influenza-like illness in a sample of healthy adults enrolled in a randomised controlled vaccine trial,
698,698,~] pergamon a model for respiratory syncytial virus (rsv) infection based on experimental aerosol exposure with bovine rsv in calves,
699,699,a novel pyrosequencing assay for the detection of neuraminidase inhibitor resistance-conferring mutations among clinical isolates of avian h7n9 influenza virus,
700,700,a follow-up of beagle dogs intradermally infected with leishmania chagasi in the presence or absence of sand fly saliva,
701,701,development of a negative pressure hood for isolation and transportation of individual patient with respiratory infectious disease,
702,702,baculovirus as versatile vectors for protein expression in insect and mammalian cells nih public access author manuscript,
703,703,human monoclonal antibodies as candidate therapeutics against emerging viruses,
704,704,original research exhaled air and aerosolized droplet dispersion during application of a jet nebulizer*,
705,705,identification of interleukin-26 in the dromedary camel (camelus dromedarius): evidence of alternative splicing and isolation of novel splice variants,
706,706,understanding the impact of face mask usage through epidemic simulation of large social networks,
707,707,non-pharmaceutical interventions for the prevention of respiratory tract infections during hajj pilgrimage,
708,708,more targeted use of oseltamivir and in-hospital isolation facilities after implementation of a multifaceted strategy including a rapid molecular diagnostic panel for respiratory viruses in immunocompromised adult patients,
709,709,incubation periods of acute respiratory viral infections: a systematic review,
710,710,"of plagues, planes and politics: controlling the global spread of infectious diseases by air",
711,711,influenza diagnosis and vaccination in poland ଝ,
712,712,impact of admission screening for meticillin-resistant staphylococcus aureus on the length of stay in an emergency department,
713,713,the role of viral persistence in flavivirus biology,
714,714,interaction of rotavirus and enterotoxigenic escherichia coli in conventionally-reared dairy calves,
715,715,fever screening at airports and imported dengue,
716,716,necessity of a more standardized virological characterization of rodents for aging studies,
717,717,optimal time delay in the control of epidemic,
718,718,"31593    rapid viral diagnosis and ambulatory management of suspected covid cases presenting at the infectious diseases referral hospital in marseille, france,  january st to march st,  a respiratory virus snapshot
Name: title, dtype: object",
719,719,viral agents causing lower respiratory tract infections in hospitalized children: evaluation of the speed-oligo® rsv assay for the detection of respiratory syncytial virus,
720,720,infectious diseases and mass gatherings,
721,721,long-term human coronavirus-myelin cross-reactive t-cell clones derived from multiple sclerosis patients,
722,722,nci-h292 as an alternative cell line for the isolation and propagation of the human paramyxoviruses,
723,723,"structure of a high-affinity ""mimotope"" peptide bound to hiv-1-neutralizing antibody b12 explains its inability to elicit gp120 cross-reactive antibodies nih public access author manuscript nih-pa author manuscript",
724,724,resource centre remains active. 5 0 -hydroxy-5 0 -homoaristeromycin: synthesis and antiviral properties,
725,725,effect of experimental ornithobacterium rhinotracheale infection along with live infectious bronchitis vaccination in broiler chickens,
726,726,viral bronchiolitis in infancy etiology and clinical features of viral bronchiolitis in infancy,
727,727,person to person droplets transmission characteristics in unidirectional ventilated protective isolation room: the impact of initial droplet size,
728,728,structure-function and application of plant lectins in disease biology and immunity,
729,729,clinical virology in real time,
730,730,zoonotic disease risk perceptions and infection control practices of australian veterinarians: call for change in work culture,
731,731,"european bat lyssaviruses: distribution, prevalence and implications for conservation",
732,732,hospital preparedness and sars,
733,733,articles impact of school closures for covid-19 on the us health-care workforce and net mortality: a modelling study,
734,734,pan-viral screening of respiratory tract infections in adults with and without asthma reveals unexpected human coronavirus and human rhinovirus diversity,
735,735,development and evaluation of a real-time taqman rt-pcr assay for the detection of infectious bronchitis virus from infected chickens,
736,736,equine arteritis virus,
737,737,articles clinical features and virological analysis of a case of middle east respiratory syndrome coronavirus infection,
738,738,total phenolic content and biological activities of enzymatic extracts from sargassum muticum (yendo) fensholt,
739,739,detection of transmissible gastroenteritis virus by rt-pcr and differentiation from porcine respiratory coronavirus,
740,740,chronic bronchial infection in copd. is there an infective phenotype?,
741,741,measuring compliance with transmission-based isolation precautions: comparison of paper-based and electronic data collection,
742,742,microbial profiling does not differentiate between childhood recurrent acute otitis media and chronic otitis media with effusion,
743,743,analysis and control of an seir epidemic system with nonlinear transmission rate,
744,744,clinical and laboratory features of severe acute respiratory syndrome vis-à -vis onset of fever*,
745,745,"28911    acute diarrhea
Name: title, dtype: object",
746,746,real-time rt-pcr detection of bovine viral diarrhoea virus in whole blood using an external rna reference,
747,747,"46676    etiologie des gastroentérites aiguës infantiles en pratique hospitalière courante
Name: title, dtype: object",
748,748,methods for studying stem cells: adult stem cells for lung repair,
749,749,confidence in controlling a sars outbreak: experiences of public health nurses in managing home quarantine measures in taiwan,
750,750,isolation and identification of a canine coronavirus strain from giant pandas (ailuropoda melanoleuca),
751,751,knowledge and practices of isolation precautions among nurses in jordan,
752,752,"2115    environmental sampling for avian influenza virus a hn in livebird markets, indonesia
Name: title, dtype: object",
753,753,health policy covid-19 and italy: what next?,
754,754,emerging tick-borne infections in mainland china: an increasing public health threat,
755,755,a quantitative risk assessment of exposure to adventitious agents in a cell culture-derived subunit influenza vaccine,
756,756,researchin veterinary science,
757,757,chapter 7 housing and welfare,
758,758,"2329    sars control and psychological effects of quarantine, toronto, canada
Name: title, dtype: object",
759,759,"115-l 26 correspondence to: w. al-nakib, 30 berkshire road",
760,760,a 2009 cross-sectional survey of procedures for post-mortem management of highly infectious disease patients in 48 isolation facilities in 16 countries: data from euronhid,
761,761,diagnostic performance of influenza viruses and rsv rapid antigen detection tests in children in tertiary care,
762,762,risk-based surveillance for avian influenza control along poultry market chains in south china: the value of social network analysis,
763,763,middle east respiratory syndrome (mers) coronavirus and dromedaries,
764,764,the ventilation of multiple-bed hospital wards in the tropics: a review,
765,765,"a sorghum xylanase inhibitor-like protein with highly potent antifungal, antitumor and hiv-1 reverse transcriptase inhibitory activities",
766,766,middle east respiratory syndrome coronavirus (mers-cov): animal to human interaction,
767,767,inactivated human platelet lysate with psoralen: a new perspective for mesenchymal stromal cell production in good manufacturing practice conditions,
768,768,the comparative pathology of severe acute respiratory syndrome and avian influenza a subtype h5n1-a review,
769,769,an immunochromatography assay for rapid antemortem diagnosis of dogs suspected to have canine distemper,
770,770,overview federal public health strategies to minimize the importation of communicable diseases into canada,
771,771,intracellular antibodies for proteomics,
772,772,evaluation of a latex agglutination kit (virogen rotatest) for detection of bovine rotavirus in fecal samples †,
773,773,camelid herd health,
774,774,an audit of the use of isolation facilities in a uk national health service trust,
775,775,time-optimal control strategies in sir epidemic models,
776,776,porcine epidemic diarrhea: a retrospect from europe and matters of debate,
777,777,detection of antibodies to avian infectious bronchitis virus by a recombinant nucleocapsid protein-based enzyme-linked immunosorbent assay,
778,778,transcriptomic profiling in childhood h1n1/09 influenza reveals reduced expression of protein synthesis genes,
779,779,response at the state and local level all disasters are local,
780,780,detection of feline coronaviruses by culture and reverse transcriptase-polymerase chain reaction of blood samples from healthy cats and cats with clinical feline infectious peritonitis,
781,781,embryo importation and cryobanking strategies for laboratory animals andwlldlifespecies,
782,782,"1 and viral diseases research team, national institute of animal health",
783,783,physical interventions to interrupt or reduce the spread of respiratory viruses: systematic review,
784,784,major articles infections with viruses and mycoplasma pneumoniae during exacerbations of chronic bronchitis,
785,785,infectivity of severe acute respiratory syndrome during its incubation period,
786,786,infectivity-neutralizing and hemagglutinin-inhibiting antibody responses to respiratory coronavirus infections of cattle in pathogenesis of shipping fever pneumonia downloaded from,
787,787,possible spread of adenovirus type 3 from poultry to humans: indirect evidence from an outbreak in china,
788,788,healthcare-associated infections: the hallmark of middle east respiratory syndrome coronavirus with review of the literature,
789,789,association of bovine respiratory disease with clinical status and acute phase proteins in calves,
790,790,"development of a real-time taqman ® rt-pcr assay for the detection of infectious bronchitis virus in chickens, and comparison of rt-pcr and virus isolation",
791,791,examination for a viral co-factor in postweaning multisystemic wasting syndrome (pmws),
792,792,the 2003 sars outbreak and its impact on infection control practices,
793,793,recently discovered human coronaviruses coronaviruses human coronavirus 229e human coronavirus nl63 human coronavirus oc43 human coronavirus hku1 severe acute respiratory syndrome-associated coronavirus recently discovered human coronaviruses,
794,794,"high-resolution ct for identify patients with smear-positive, active pulmonary tuberculosis",
795,795,two amino acid changes at the n-terminus of transmissible gastroenteritis coronavirus spike protein result in the loss of enteric tropism,
796,796,virologic studies of acute respiratory disease in young adults v. coronavirus 229e infections during six years of surveillance,
797,797,neurotropism of mouse-adapted haemagglutinating encephalomyelitis virus,
798,798,characterization of an influenza a (h3n2) virus isolated from pigs in england in 1987,
799,799,antibody detection of sars-cov spike and nucleocapsid protein,
800,800,"14941    what are the most appropriate methods of surveillance for monitoring an emerging respiratory infection such as sars?
Name: title, dtype: object",
801,801,screening of neonatal calves for persistent infection with bovine viral diarrhea virus by immunohistochemistry on skin biopsy samples downloaded from,
802,802,"co-infections, genetic, and antigenic relatedness of avian influenza h5n8 and h5n1 viruses in domestic and wild birds in egypt",
803,803,the global threats from naturally occurring infectious diseases,
804,804,natural killer (nk) activity and interferon (ifn) production by a fraction of spleen and blood lymphocytes in swine,
805,805,construction of a non-infectious sars coronavirus replicon for application in drug screening and analysis of viral protein function,
806,806,limited transmission of turkey coronavirus in young turkeys by adult alphitobius diaperinus (coleoptera: tenebrionidae),
807,807,sars -beginning to understand a new virus,
808,808,-nc-nd license (http://creativecommons.org/licenses/by-nc-nd/4.0/). peer-review under responsibility of the centro congressi internazionale srl a study on the contaminant dispersion from isolation ward under abnormal operation of facilities peer-review under responsibility of the centro congressi internazionale srl,
809,809,macrophage colony-stimulating factor (csf1) controls monocyte production and maturation and the steady-state size of the liver in pigs licensed under creative commons attribution cc-by 3.0,
810,810,hiv-infected microglia mediate cathepsin b induced neurotoxicity,
811,811,mathematical analysis of the ross-macdonald model with quarantine,
812,812,comparative sequence analyses of a new mammalian reovirus genome and the mammalian reovirus s1 genes from six new serotype 2 human isolates,
813,813,development and validation of a taqman real-time reverse transcription-pcr for rapid detection of feline calicivirus,
814,814,passive immunotherapy of viral infections: 'super-antibodies' enter the fray,
815,815,the influence of human walking on the flow and airborne transmission in a six-bed isolation room: tracer gas simulation,
816,816,infectivity-neutralizing and hemagglutinin-inhibiting antibody responses to respiratory coronavirus infections of cattle in pathogenesis of shipping fever pneumonia downloaded from,
817,817,"campesin, a thermostable antifungal peptide with highly potent antipathogenic activities",
818,818,rotavirus infections associated with diarrhoea in calves in egypt,
819,819,structural basis for human coronavirus attachment to sialic acid receptors hhs public access author manuscript,
820,820,"45028    the time is now moving toward virusspecific t cells after allogeneic hematopoietic stem cell transplantation as the standard of care
Name: title, dtype: object",
821,821,viral rna extraction for in-the-field analysis,
822,822,severe acute respiratory syndrome (sars): chest radiographic features in children,
823,823,the intraspleen hupbl nod/scid model to study the human hiv-specific antibody response selected in the course of natural infection,
824,824,porcine deltacoronavirus induces caspase-dependent apoptosis through activation of the cytochrome c-mediated intrinsic mitochondrial pathway,
825,825,"outside the box and into thick air: implementation of an exterior mobile pediatric emergency response team for north american h1n1 (swine) influenza virus in houston, texas",
826,826,"characterization of a monoclonal antibody to a novel glycan- dependent epitope in the v1/v2 domain of the hiv-1 envelope protein, gp120 nih public access author manuscript",
827,827,association of swine infl uenza h1n1 pandemic virus (siv- h1n1p) with porcine respiratory disease complex in sows from commercial pig farms in colombia,
828,828,literature-related discovery: potential treatments and preventatives for sars ☆,
829,829,"middle east respiratory syndrome coronavirus (mers-cov) outbreak in south korea, 2015: epidemiology, characteristics and public health implications",
830,830,review school closure and management practices during coronavirus outbreaks including covid-19: a rapid systematic review,
831,831,~ clinical and diagnostic virology detection of respiratory syncytial virus infection in nasal aspirate samples by flow cytometry,
832,832,review molecular diagnosis of severe acute respiratory syndrome the state of the art,
833,833,testing the repatriated for sars-cov2: should laboratory-based quarantine replace traditional quarantine?,
834,834,"nowcasting and forecasting the potential domestic and international spread of the 2019-ncov outbreak originating in wuhan, china: a modelling study",
835,835,transportation capacity for patients with highly infectious diseases in europe: a survey in 16 nations,
