,Unnamed: 0,title,isNPI
836,836,dealing with threat of drug-resistant tuberculosis: background information for interpreting the andrew speaker and related cases,
837,837,isolation of human monoclonal antibodies from peripheral blood b cells,
838,838,what is the best control strategy for multiple infectious disease outbreaks?,
839,839,the effect of treatment on pathogen virulence,
840,840,nucleic acid sequence-based amplification methods to detect avian influenza virus,
841,841,the world federation: enhancing global critical care practice and performance,
842,842,"the clinical importance of the nomenclature, evolution and taxonomy of human papillomaviruses",
843,843,emerging studies of human hiv-specific antibody repertoires,
844,844,legal aspects of biosecurity,
845,845,"molecular characterization of hlj-073, a recombinant canine coronavirus strain from china with an orf3abc deletion",
846,846,visual detection of turkey coronavirus rna in tissues and feces by reverse-transcription loop-mediated isothermal amplification (rt-lamp) with hydroxynaphthol blue dye,
847,847,a model for the spread and control of pandemic influenza in an isolated geographical region,
848,848,intervals before tuberculosis diagnosis and isolation at a regional hospital in taiwan,
849,849,"the effect of hospital isolation precautions on patient outcomes and cost of care: a multi-site, retrospective, propensity score-matched cohort study",
850,850,simulating school closure strategies to mitigate an influenza epidemic nih public access,
851,851,the covid-19 pandemic: important considerations for contact lens practitioners,
852,852,"evaluation of some etiological factors predisposing to diarrhoea in lambs in ""la serena"" (southwest spain)",
853,853,china vs the who: a behavioural norm conflict in the sars crisis,
854,854,the growth and potential of human antiviral monoclonal antibody therapeutics,
855,855,6 avian infectious bronchitis virus,
856,856,first isolation of clostridium perfringens type e from a goat with diarrhea,
857,857,evaluation of mers-cov neutralizing antibodies in sera using live virus microneutralization assay,
858,858,a risk-assessment model to rate the occurrence and relevance of adventitious agents in the production of influenza vaccines,
859,859,"41911    newly discovered coronavirus as the primary cause of severe acute respiratory syndrome
Name: title, dtype: object",
860,860,isolation of tioman virus from pteropus giganteus bat in north-east region of india,
861,861,fidelity variants and rna quasispecies,
862,862,sustainability of high-level isolation capabilities among us ebola treatment centers dispatches,
863,863,protein engineering strategies for the development of viral vaccines and immunotherapeutics,
864,864,diagnostics-in-a-suitcase: development of a portable and rapid assay for the detection of the emerging avian influenza a (h7n9) virus,
865,865,using an integrated infection control strategy during outbreak control to minimize nosocomial infection of severe acute respiratory syndrome among healthcare workers,
866,866,live cell reporter systems for positive-sense single strand rna viruses,
867,867,"risk factors for pandemic (h1n1) 2009 virus seroconversion among hospital staff, singapore",
868,868,impact of multiplex polymerase chain reaction testing for respiratory pathogens on healthcare resource utilization for pediatric inpatients hhs public access,
869,869,using sirna in prophylactic and therapeutic regimens against sars coronavirus in rhesus macaque a r t i c l e s,
870,870,differentiated cultures of primary hamster tracheal airway epithelial cells,
871,871,evaluation of a single-tube fluorogenic rt-pcr assay for detection of bovine respiratory syncytial virus in clinical samples,
872,872,isolation and sequence analysis of canine respiratory coronavirus,
873,873,preparing the intensive care unit for disaster preparing the icu for disaster,
874,874,description of a hospital outbreak of middle east respiratory syndrome in a large tertiary care hospital in saudi arabia,
875,875,development of a large-scale isolation chamber system for the safe and humane care of medium-sized laboratory animals harboring infectious diseases *,
876,876,recent advances in the study of human antibody responses to influenza virus using optimized human hybridoma approaches,
877,877,tracking the engraftment and regenerative capabilities of transplanted lung stem cells using fluorescent nanodiamonds,
878,878,isolation of coronaviruses from neonatal calf diarrhoea in great britain and denmark,
879,879,addressing the gaps in preparation for quarantine,
880,880,"the preparation of chicken tracheal organ cultures for virus isolation, propagation, and titration",
881,881,viral loads and duration of viral shedding in adult patients hospitalized with influenza,
882,882,comparative analysis of four massachusetts type infectious bronchitis coronavirus genomes reveals a novel massachusetts type strain and evidence of natural recombination in the genome,
883,883,human rhinovirus infections of the lower respiratory tract in hematopoietic stem cell transplant recipients,
884,884,post-exposure prophylaxis for middle east respiratory syndrome in healthcare workers,
885,885,"temperature, nitrogen dioxide, circulating respiratory viruses and acute upper respiratory infections among children in taipei, taiwan: a population-based study",
886,886,initial test of emergency procedure performance in temporary negative pressure isolation by using simulation technologies,
887,887,impact of porcine group a rotavirus co-infection on porcine epidemic diarrhea virus pathogenicity in piglets,
888,888,access to,
889,889,physica a the global dynamics for a stochastic sis epidemic model with isolation,
890,890,an evaluation of portable high-efficiency particulate air filtration for expedient patient isolation in epidemic and emergency response,
891,891,rapid pre-clinical detection of classical swine fever by reverse transcription loop-mediated isothermal amplification,
892,892,effects of cold storage on detection of avian infectious bronchitis virus in chicken carcasses and local antibodies in tracheal washes,
893,893,issues relevant to the adoption and modification of hospital infection-control recommendations for avian influenza (h5n1 infection) in developing countries,
894,894,"characterization of a monoclonal antibody to a novel glycan-dependent epitope in the v1/v2 domain of the hiv-1 envelope protein, gp120",
895,895,community pharmacists and communication in the time of covid-19: applying the health belief model,
896,896,chapter 14 sapelovirus,
897,897,pandemic infl uenza and pregnant women,
898,898,influenza vaccines have a short but illustrious history of dedicated science enabling the rapid global production of a/swine (h1n1) vaccine in the current pandemic,
899,899,cell host & microbe review principles of broad and potent antiviral human antibodies: insights for vaccine design,
900,900,science delivering to regulators,
901,901,50 general measures of infection control,
902,902,monoclonal antibodies and antibody like fragments derived from immunised phage display libraries,
903,903,steroid-induced osteonecrosis in severe acute respiratory syndrome: a retrospective analysis of biochemical markers of bone metabolism and corticosteroid therapy,
904,904,control of a hospital-wide vancomycin-resistant enterococci outbreak,
905,905,localization of an rna-binding domain in the nucleocapsid protein of the coronavirus mouse hepatitis virus,
906,906,defense threat reduction agency,
907,907,use of a portable forced air system to convert existing hospital space into a mass casualty isolation area,
908,908,"1 and viral diseases research team, national institute of animal health",
909,909,antigenic and biological comparisons of bovine coronaviruses derived from neonatal calf diarrhea and winter dysentery of adult cattle brief report,
910,910,functional characterization of mouse spinal cord infiltrating cd8+ lymphocytes,
911,911,"2233    sars vaccine protective in mice
Name: title, dtype: object",
912,912,depression after exposure to stressful events: lessons learned from the severe acute respiratory syndrome epidemic,
913,913,"masstag polymerase-chain-reaction detection of respiratory pathogens, including a new rhinovirus genotype, that caused influenza-like illness in new york state during 2004-2005",
914,914,articles interventions to mitigate early spread of sars-cov-2 in singapore: a modelling study,
915,915,"3 rti international inc., p.o. 12194, 3040 cornwallis rd",
916,916,dianke virus: a new mesonivirus species isolated from mosquitoes in eastern senegal,
917,917,generating and evaluating type i interferon receptor-deficient and feline tmprss2-expressing cells for propagating serotype i feline infectious peritonitis virus,
918,918,species-independent detection of rna virus by representational difference analysis using non-ribosomal hexanucleotides for reverse transcription,
919,919,"detection of viral, chlamydia pneumoniae and mycoplasma pneumoniae infections in exacerbations of asthma in children",
920,920,the influence of a sense of time on human development nih public access,
921,921,predicting support for non-pharmaceutical interventions during infectious outbreaks: a four region analysis,
922,922,improving estimates of the basic reproductive ratio: using both the mean and the dispersal of transition times,
923,923,221-231) 2school of veterinary medicine,
924,924,"2274    serologic and molecular biologic methods for sarsassociated coronavirus infection, taiwan
Name: title, dtype: object",
925,925,rapid identification of imported influenza viruses at xiamen international airport via an active surveillance program,
926,926,c ann arbor veterans affairs hospital,
927,927,transport of exhaled particulate matter in airborne infection isolation rooms,
928,928,a spike-specific whole-porcine antibody isolated from a porcine b cell that neutralizes both genogroup 1 and 2 pedv strains,
929,929,building and environment 107 (2016) 154e168,
930,930,"quarantine for sars, taiwan",
931,931,screening of neonatal calves for persistent infection with bovine viral diarrhea virus by immunohistochemistry on skin biopsy samples downloaded from,
932,932,depression after exposure to stressful events: lessons learned from the sars epidemic,
933,933,clinical infectious diseases risk factors for transmission of middle east respiratory syndrome coronavirus infection during the 2015 outbreak in south korea,
934,934,our world as a learning system: a communities-of-practice approach,
935,935,pneumopathies dites atypiques à coronavirus atypical pneumonia caused by coronavirus,
936,936,care of patients with liver disease during the covid-19 pandemic: easl-escmid position paper,
937,937,journal pre-proof the covid-19 pandemic: implications for the cytology laboratory title: the covid-19 pandemic: implications for the cytology laboratory,
938,938,"infectious mers-cov isolated from a mildly ill patient, saudi arabia",
939,939,characteristics of covid-19 infection in beijing,
940,940,contacting passengers after exposure to measles on an international flight: implications for responding to new disease threats and bioterrorism,
941,941,diagnosis of canine coronavirus infection using nested-pcr,
942,942,state of diagnosing infectious pathogens using colloidal nanomaterials,
943,943,an overview of the national microbiology laboratory emergency management program,
944,944,panblok-h1cadvax h1n1/2009pdm vaccine: insights into rapid development of a delta inulin adjuvanted recombinant pandemic influenza vaccine,
945,945,numerical study on the dispersion of airborne contaminants from an isolation room in the case of door opening,
946,946,modeling control strategies of respiratory pathogens,
947,947,recombinant vesicular stomatitis virus expressing the spike protein of genotype 2b porcine epidemic diarrhea virus: a platform for vaccine development against emerging epidemic isolates,
948,948,comparison of the efficiency of antibody selection from semi-synthetic scfv and non-immune fab phage display libraries against protein targets for rapid development of diagnostic immunoassays,
949,949,corresponding author(s): experimental design 1. sample size,
950,950,pathogenic leptospira spp. in bats: molecular investigation in southern brazil a r t i c l e i n f o,
951,951,"blood component recalls and market withdrawals: frequency, reasons, and management in the united states",
952,952,"sars outbreaks in ontario, hong kong and singapore: the role of diagnosis and isolation as a control mechanism",
953,953,"severe acute respiratory syndrome (sars) and the gdp. part i : epidemiology, virology, pathology and general health issues",
954,954,virus diffusion in isolation rooms,
955,955,special issue control of severe acute respiratory syndrome in singapore,
956,956,experimental infection of dogs with a novel strain of canine coronavirus causing systemic disease and lymphopenia,
957,957,small indian mongooses and masked palm civets serve as new reservoirs of bartonella henselae and potential sources of infection for humans,
958,958,observing and quantifying airflows in the infection control of aerosol-and airborne-transmitted diseases: an overview of approaches,
959,959,virologie : l'apport de la biologie moléculaire dans le diagnostic microbiologique en pneumopédiatrie microbiological approaches with molecular biological diagnosis to paediatric respiratory viral infections,
960,960,evacuation of the icu care of the critically ill and injured during pandemics and disasters: chest consensus statement,
961,961,"influenza in travelers: epidemiology, risk, prevention, and control issues",
962,962,detection of economically important viruses in boar semen by quantitative realtime pcr tm technology,
963,963,isolation of porcine epidemic diarrhea virus in porcine cell cultures and experimental infection of pigs of different ages,
964,964,establishment of a novel ovine kidney cell line for isolation and propagation of viruses infecting domestic cloven-hoofed animal species,
965,965,an antibody against the f glycoprotein inhibits nipah and hendra virus infections author contributions,
966,966,shaping ethical guidelines for an influenza pandemic,
967,967,journal pre-proof the effective use of telemedicine to save lives and maintain structure in a healthcare system: current response to covid-1 the effective use of telemedicine to save lives and maintain structure in a healthcare system: current response to covid-19,
968,968,optimizing antibiotic selection in treating copd exacerbations,
969,969,integrated sensor systems and data fusion for homeland protection,
970,970,mass spectrometry based proteomic studies on viruses and hosts -a review,
971,971,a model for coupled outbreaks contained by behavior change,
972,972,disaster preparedness lessons learned and future directions for education: results from focus groups conducted at the 2006 apic conference,
973,973,the use of infrared thermography as an early indicator of bovine respiratory disease complex in calves,
974,974,isolation and functional studies on feline bone marrow derived macrophages,
975,975,"archives of virology isolation of a eoronavirus durin9 studies on puffinosis, a disease of the manx shearwater (pu//inus pu/[inus)",
976,976,a pandemic influenza modeling and visualization tool $,
977,977,genotyping of infectious bronchitis viruses from broiler farms in iraq during 2014-2015,
978,978,"23043    cell culture propagation of bovine coronavirus
Name: title, dtype: object",
979,979,development of a nested pcr assay for the detection of canine coronavirus,
980,980,common cold 211 interventions to prevent transmission of the common cold,
981,981,isolation and characterization of lymphocytes from bovine intestinal epithelium and lamina propria,
982,982,development of a pcr-and hybridization-based assay (pcr adenovirus consensus ® ) for the detection and the species identification of adenoviruses in respiratory specimens,
983,983,adverse effects of isolation in hospitalised patients: a systematic review,
984,984,isolation of a variant infectious bronchitis virus in australia that further illustrates diversity among emerging strains,
985,985,sars-associated coronavirus replication in cell lines sars-associated coronavirus replication in cell lines,
986,986,monoclonal antibodies -a proven and rapidly expanding therapeutic modality for human diseases,
987,987,safety and efficacy of a modified-live canine coronavirus vaccine in dogs,
988,988,characterization of the antiviral effects of interferon-α against a sars-like coronoavirus infection in vitro,
989,989,genetic and pathogenic characterization of a novel reassortant mammalian orthoreovirus 3 (mrv3) from a diarrheic piglet and seroepidemiological survey of mrv3 in diarrheic pigs from east china,
990,990,impact of severe acute respiratory syndrome on the status of lung cancer chemotherapy patients and a correlation of the signs and symptoms,
991,991,dynamic airflow simulation within an isolation room,
992,992,predictions and measurements of the stack effect on indoor airborne virus transmission in a high-rise hospital building,
993,993,effect of faecal consistency on virological diagnosis,
994,994,diversification of importin-α isoforms in cellular trafficking and disease states,
995,995,optimal and sub-optimal quarantine and isolation control in sars epidemics,
996,996,disease contact tracing in random and clustered networks,
997,997,managing public health crises: the role of models in pandemic preparedness,
998,998,molecular detection of microbes p941 direct detection of salmonella spp. in faecal specimens by real-time pcr assay p942 multicentric evaluation of onychodiagò for diagnosis of dermatophyte onychomycosis by pcr-elisa p943 validation of pcr-rflp analysis of the gap gene as a useful tool for the species-level identification of staphylococcal isolates p944 clonal complexity in coagulase negative staphylococcus catheter-related bloodstream infection p945 effect of treatment on toxoplasma-specific igg antibodies and igg avidity maturation p947 diagnosis of human brucellosis using amos pcr p948 evaluation and comparison of molecular tests for identification of methicillin-resistant staphylococcus aureus,
999,999,point-of-care microdevices for blood plasma analysis in viral infectious diseases,
1000,1000,the presence of co-infections in pigs with clinical signs of pmws in the netherlands: a case-control study,
1001,1001,"531    resource allocation during an influenza pandemic
Name: title, dtype: object",
1002,1002,an antifungal defensin from phaseolus vulgaris cv. 'cloud bean',
1003,1003,protective effect of an inactivated avian coronavirus vaccine administered by aerosol,
1004,1004,isolation and characterization of polymorphic microsatellite markers for the masked palm civet (paguma larvata),
1005,1005,genetic structure of mountain lion (puma concolor) populations in california,
1006,1006,neonates investigated for influenza-like illness during the outbreak of pandemic h1n1 2009: trivial infections but major triage implications,
1007,1007,genotyping of avian infectious bronchitis viruses in iran (2015-2017) reveals domination of is-1494 like virus,
1008,1008,"murine encephalitis caused by hcov-oc43, a human coronavirus with broad species specificity, is partly immune-mediated",
1009,1009,impact of infection prevention and control initiatives on acute respiratory infections in a pediatric long-term care facility hhs public access,
1010,1010,autophagy during viral infection -a double-edged sword,
1011,1011,modeling approaches toward understanding infectious disease transmission,
1012,1012,recent advances in the study of human antibody responses to influenza virus using optimized human hybridoma approaches,
1013,1013,hospital and community acquired infection and the built environment design and testing of infection control rooms,
1014,1014,the experience of the 2003 sars outbreak as a traumatic stress among frontline healthcare workers in toronto: lessons learned,
1015,1015,"journal pre-proof 1000,000 cases of covid-19 outside of china: the date predicted by a simple heuristic 1,000,000 cases of covid-19 outside of china: the date predicted by a simple heuristic",
1016,1016,-nc-nd license (http://creativecommons.org/licenses/by-nc-nd/4.0/),
1017,1017,infecciones víricas,
1018,1018,mers: emergence of a novel human coronavirus,
1019,1019,fexaramine as an entry blocker for feline caliciviruses,
1020,1020,search past issues of eid at www.cdc.gov/eid,
1021,1021,infection control practices among hospital health and support workers in hong kong,
1022,1022,journal pre-proof rapid surveillance of covid-19 in the united states using a prospective space-time scan statistic: detecting and evaluating emerging clusters author statement rapid surveillance of covid-19 in the united states using a prospective space-time scan statistic: detecting and evaluating emerging clusters,
1023,1023,a role for the clostridium perfringens b2 toxin in bovine enterotoxaemia?,
1024,1024,serotype shift of a 793/b genotype infectious bronchitis coronavirus by natural recombination,
1025,1025,murine sarcoma virus transformation of balb/3t3 cells: lack of dependence on murine leukemia virus,
1026,1026,isolation and propagation of coronaviruses in embryonated eggs,
1027,1027,molecular characterization of adenoviral infections in cuba: report of an unusual association of species d adenoviruses with different clinical syndromes,
1028,1028,quantifying social distancing arising from pandemic influenza,
1029,1029,physica a model of epidemic control based on quarantine and message delivery,
1030,1030,modeling the impact of behavior changes on the spread of pandemic influenza,
1031,1031,mathematical a discrete epidemic model for sars transmission and control in china,
1032,1032,hplc analysis and purification of peptides,
1033,1033,production of antibody fab fragments in escherichia coli,
1034,1034,viral infections associated with kawasaki disease,
1035,1035,"porcine deltacoronavirus infection: etiology, cell culture for virus isolation and propagation, molecular epidemiology and pathogenesis",
1036,1036,a lair-1 insertion generates broadly reactive antibodies against malaria variant antigens,
1037,1037,chapter 2 preparation of recombinant viral glycoproteins for novel and therapeutic antibody discovery,
1038,1038,intensive care management of coronavirus disease 2019 (covid-19): challenges and recommendations,
1039,1039,viral epidemiology of acute exacerbations of chronic obstructive pulmonary disease 1,
1040,1040,interaction of the innate immune system with positive-strand rna virus replication organelles-nc-nd license (http://creativecommons.org/licenses/by-nc-nd/4.0/),
1041,1041,impact of multiplex polymerase chain reaction testing for respiratory pathogens on healthcare resource utilization for pediatric inpatients mpcr multiplex polymerase chain reaction pcr polymerase chain reaction phis pediatric health information system picu pediatric intensive care unit rsv respiratory syncytial virus,
1042,1042,culture-dependent and metagenomic analysis of lesser horseshoe bats' gut microbiome revealing unique bacterial diversity and signatures of potential human pathogens,
1043,1043,a secretary bi-cistronic baculovirus expression system with improved production of the ha1 protein of h6 influenza virus in insect cells and spodoptera litura larvae,
1044,1044,"structure, immunopathogenesis and vaccines against sars coronavirus",
1045,1045,neutralizing capacity of monoclonal antibodies that recognize peptide sequences underlying the carbohydrates on gp41 of simian immunodeficiency virus,
1046,1046,"dynamics of an seqihrs epidemic model with media coverage, quarantine and isolation in a community with pre-existing immunity",
1047,1047,a predictive decision-aid methodology for dynamic mitigation of influenza pandemics,
1048,1048,development of a reverse transcription multiplex real-time pcr for the detection and genotyping of classical swine fever virus,
1049,1049,unknown unknowns -covid-19 and potential global mortality,
1050,1050,a model of bi-mode transmission dynamics of hepatitis c with optimal control,
1051,1051,to appear in: public health,
1052,1052,development of recombinant measles virus-based vaccines,
1053,1053,emerging viral diseases of livestock in the developing world,
1054,1054,the veterinary journal,
1055,1055,semin respir crit care med,
1056,1056,evolutionary medicine: a powerful tool for improving human health,
1057,1057,eingang des manuskripts: 28. 9,
1058,1058,investigation of nonlinear epidemiological models for analyzing and controlling the mers outbreak in korea,
1059,1059,epidemiology and infection seeking out sari: an automated search of electronic health records,
1060,1060,colonization of parasites and vectors,
1061,1061,"45752    rethinking hospital general ward ventilation design using computational fluid dynamics
Name: title, dtype: object",
1062,1062,potential airborne transmission between two isolation cubicles through a shared anteroom,
1063,1063,phylogeny and biogeography of western indian ocean rousettus (chiroptera: pteropodidae),
1064,1064,comparative analysis on the 5 0 -untranslated region of bovine viral diarrhea virus isolated in korea,
1065,1065,the immuno-pathophysiology of multiple sclerosis nih public access author manuscript,
1066,1066,haemagglutinin-esterase protein (he) of murine corona virus: dvim (diarrhea virus of infant mice),
1067,1067,modeling the case of early detection of ebola virus disease,
